{
  "schemaVersion": "1.1.0",
  "id": "example-first-milestone",
  "title": "Example queued milestone (placeholder)",
  "kind": "tooling",
  "objective": "Add one bounded and objectively verified tooling improvement as the first tracked milestone.",
  "rationale": "A small tooling increment exercises the full plan/implement/verify/review loop before product work begins.",
  "dependencies": [],
  "permittedPaths": ["tools/milestone-orchestrator/**"],
  "exclusions": [
    "No product feature work.",
    "No frozen authority changes."
  ],
  "acceptanceCriteria": [
    {
      "id": "bounded-behavior",
      "description": "The bounded behavior works through its public command.",
      "evidence": "A focused automated test and command result pass."
    }
  ],
  "requiredTests": ["pnpm test:orchestrator"],
  "verificationCommands": [
    {
      "id": "orchestrator-tests",
      "executable": "pnpm",
      "args": ["test:orchestrator"],
      "parser": "exit-code"
    },
    {
      "id": "authoritative-verification",
      "executable": "pnpm",
      "args": ["verify"],
      "parser": "pnpm-verify"
    }
  ],
  "expectedArtifacts": ["verification-summary.json"],
  "terminalConditions": ["All commands and independent review pass."],
  "estimatedFileCount": 4,
  "requiresBrowserInspection": false,
  "requiresHeadlessEvaluation": false,
  "hiddenValidation": { "requested": false },
  "verticalSlice": {
    "mode": "not-applicable",
    "userGoal": null,
    "publicActionKinds": [],
    "sharedRuleOwners": [],
    "standardCompositionOwner": null,
    "persistenceReplayEvidence": [],
    "nodeWorkerParityEvidence": [],
    "inspectableConsequence": null,
    "exception": null
  }
}
